Pennsylvania,Kutztown University of Pennsylvania,BS.Ed. Special Education PreK-12,Bachelors,In Person,No,ECSE,https://www.kutztown.edu/academics/colleges-and-departments/education/departments/special-education/programs/bachelor-of-science-in-special-education.html
Pennsylvania,La Roche University,B.A. PK-12 Special Education,Bachelors,In Person,No,ECSE,https://www.laroche.edu/Academics/Areas_of_Study/Education/Degrees_and_Requirements/?pid=244
Pennsylvania,La Roche University,B.A. PreK-4 Education with PK-12 Special Education,Bachelors,In Person,No,Dual,https://www.laroche.edu/Academics/Areas_of_Study/Education/Degrees_and_Requirements/?pid=197
Pennsylvania,La Salle University,B.A. Education - Early Elementary PreK–4 and Special Education PreK–8 (ESEC),Bachelors,In Person,No,Dual,https://www.lasalle.edu/catalog/undergraduate/school-of-arts-and-sciences/department-of-education/education-pre-k-thru-4thspecial-ed/
Pennsylvania,Lebanon Valley College,BS Early Childhood Special Education (Dual Major Early Childhood Education (PreK-4) and Special Education (PreK-8)),Bachelors,In Person,No,Dual,https://www.lvc.edu/academics/undergraduate-studies/education/elementary-special-education/
Pennsylvania,Lock Haven University,BSED Education Dual Major - PreK-4 and Special Ed PK-12,Bachelors,In Person,No,Dual,https://lockhaven.edu/earlychildhood/#tab-2
Pennsylvania,Lock Haven University,BSED Special Ed PK-12,Bachelors,In Person,No,ECSE,https://lockhaven.edu/specialeducation/#tab-2
Pennsylvania,Lycoming College,B.S. Education dual major ECE and Special Education PK-12,Bachelors,In Person,No,Dual,https://www.lycoming.edu/education/
Pennsylvania,Mansfield University of Pennsylvania,B.S.Ed. Early Childhood and Elementary Education with Optional Special Education Certification,Bachelors,In Person,No,Dual,https://www.mansfield.edu/majors-and-minors/early-childhood-education/index.cfm
Pennsylvania,Marywood University,"Special Education PK-8 with Grades PK-4, Bachelor of Science",Bachelors,In Person,No,Dual,https://marywood.smartcatalogiq.com/en/2022-2023/undergraduate-catalog/college-of-professional-studies/school-of-education/education-degrees/special-education-pk-8-with-grades-pk-4-bachelor-of-science/
Pennsylvania,Mercyhurst University,Bachelor's Early Childhood Education PreK-4 / PreK-8 Special Education Dual Major,Bachelors,In Person,No,Dual,https://www.mercyhurst.edu/academics/education
Pennsylvania,Messiah College,B.S. Education with Dual Certification (Grades Pre-K through 4th) and Special Education (Pre-K through 12th),Bachelors,In Person,No,Dual,https://www.messiah.edu/undergraduate/education-major-with-dual-teaching-certification-in-grades-prek-4-and-special-education-prek-8
Pennsylvania,Messiah College,B.S. Special Education N-12 with Teaching Certification PreK-12,Bachelors,In Person,No,Dual,https://www.messiah.edu/a/ugrad-program-pages/index-words.php/?urlSlug=special-education-grades-n-12-with-teaching-certification-in-grades-prek-12
Pennsylvania,Millersville University of Pennsylvania,B.S.ED. Special Education,Bachelors,In Person,No,ECSE,https://www.millersville.edu/specialeducation/bsed-special-education-pk-12.php
Pennsylvania,Misericordia University,Early Childhood Education/Special Education BS,Bachelors,In Person,No,Dual,https://www.misericordia.edu/education/education
Pennsylvania,Misericordia University,Special Education,Bachelors,In Person,No,ECSE,https://www.misericordia.edu/education/education
Pennsylvania,Moravian University,BA Early Childhood Special Education with Dual Certification,Bachelors,In Person,No,Dual,https://www.moravian.edu/education/undergraduate-certifications/special-education
Pennsylvania,Neumann University,BA Early Elementary and Special Education,Bachelors,In Person,No,Dual,https://www.neumann.edu/academics/undergrad/education/index.asp?hsCtaTracking=40dd9990-06a6-4ee2-9342-0472c955001f%7C26f871ed-99ed-4ccd-93da-1ba59dd800fe
Pennsylvania,Point Park University,B.A. –Special Education (PreK– Grade12),Bachelors,In Person,No,ECSE,https://www.pointpark.edu/about/admindepts/academicandstudent/universitycatalogs/point-park-undergrad-catalog-2022-20231.pdf
Pennsylvania,Robert Morris University,Early Childhood Education B.S. (Special Education concentration),Bachelors,In Person,No,Dual,https://www.rmu.edu/academics/undergraduate/snehs/education/early-childhood-education-bs-special-education
Pennsylvania,Robert Morris University,Special Education PK-12 B.S.,Bachelors,In Person,No,ECSE,https://www.rmu.edu/academics/undergraduate/special-education-pk-12-bs
Pennsylvania,Rosemont College,BS Elementary Education PK-4 with PK-12 Special Education,Bachelors,In Person,No,Dual,https://www.rosemont.edu/academics/undergraduate/areas-of-study/education/degree-requirements-pk4-and-special-education.php
Pennsylvania,Saint Francis University,B.S. Education in Special Education PreK-12,Bachelors,In Person,No,ECSE,https://catalog.francis.edu/preview_program.php?catoid=15&poid=6845&hl=%22special+education%22&returnto=search
Pennsylvania,Saint Francis University,"Early Childhood Education (PreK-Grade 4)/Special Education (Pre-K - Grade 12), B.S.",Bachelors,In Person,No,Dual,https://catalog.francis.edu/preview_program.php?catoid=15&poid=6729&hl=%22special+education%22&returnto=search
Pennsylvania,Saint Joseph's University,"BS in Education with Special Education PK-8 Certification
 (Special Education PK-8 must be a double major with Elementary PK-4)",Bachelors,In Person,No,Dual,https://academiccatalog.sju.edu/education-humandev/education/special-ed/pk12-major/#requirementstext
Pennsylvania,Saint Joseph's University,Education - Elementary/PK-4 & Special Education Dual Major,Bachelors,In Person,No,ECSE,https://www.sju.edu/degree-programs/education-special-education-elementarypk-4-dual-major
Pennsylvania,Saint Vincent College,"B.S. Education Early Childhood PreK-4 **note: coursework is inclusive of Minor in Disability Studies: Special Education, which leads to Certification in Special Education PK-8 in PA",Bachelors,In Person,No,Dual,https://www.stvincent.edu/academics/undergraduate-programs/programs/disability-studies-special-education.html
Pennsylvania,Seton Hill University,B.A. Elementary Education (Pre K to Grade 4) with Special Education (Pre K to Grade 12),Bachelors,In Person,No,Dual,https://www.setonhill.edu/academics/undergraduate-programs/elementary-education-with-special-education/
Pennsylvania,Shippensburg University of Pennsylvania,"Special Education and Early Childhood Education, B.S.Ed.",Bachelors,In Person,No,Dual,https://www.ship.edu/programs/special-education-early-childhood-education/
Pennsylvania,Slippery Rock University of Pennsylvania,"B.S. in Education program, with a focus on Early Childhood and Special Education",Bachelors,In Person,No,Dual,https://www.sru.edu/academics/majors-and-minors/early-childhood-(pk-4)-/-special-education-(k-8)
Pennsylvania,Slippery Rock University of Pennsylvania,"SPECIAL EDUCATION (K-12), BACHELOR OF SCIENCE IN EDUCATION (BSED)",Bachelors,In Person,No,ECSE,https://catalog.sru.edu/undergraduate/education/special-education/special-education-bsed/#curriculumguidetext
Pennsylvania,Susquehanna University,BS SPECIAL EDUCATION PK-12,Bachelors,In Person,No,ECSE,https://www.susqu.edu/academics/majors-and-minors/department-of-education/special-education/
Pennsylvania,Temple University,"Bachelor of Science in Education in Early Childhood Education, Special Education Concentration",Bachelors,In Person,No,Dual,https://www.temple.edu/academics/degree-programs/early-childhood-education-major-ed-eced-bsed
Pennsylvania,Temple University,Bachelor of Science in Education in Special Education (Pre-K to 12),Bachelors,In Person,No,ECSE,https://ed.psu.edu/special-education-bachelor-science
Pennsylvania,The Pennsylvania State University,B.S. in Special Education,Bachelors,In Person,No,ECSE,https://ed.psu.edu/epcse/special-education/programs/bachelors-of-science
Pennsylvania,Thiel College,B.A. Education – Early Childhood and Special Education,Bachelors,In Person,No,Dual,https://www.thiel.edu/academics/departments/education/majors-and-programs/education-early-childhood-special-education-major
Pennsylvania,University of Pittsburgh-Greensburg,Double major ECE (PreK-4) and Special Education (PK-12),Bachelors,In Person,No,Dual,https://www.greensburg.pitt.edu/academics/majors-minors/education/special-education/maps
Pennsylvania,University of Pittsburgh-Greensburg,SPECIAL EDUCATION PK-12,Bachelors,In Person,No,ECSE,https://www.greensburg.pitt.edu/academics/majors-minors/education/special-education/maps
Pennsylvania,University of Pittsburgh-Johnstown,Early Childhood with Special Education Certification (BA),Bachelors,In Person,No,Dual,https://www.johnstown.pitt.edu/academics/majors-programs/education/early-childhood-special-education-ba
Pennsylvania,University of Pittsburgh-Pittsburgh Campus,Bachelor of Science in Teacher Education in Special Education,Bachelors,In Person,No,ECSE,https://www.education.pitt.edu/academics/teacher-education/bachelor-science-teacher-education
Pennsylvania,University of Valley Forge,BS Early Childhood Education - dual PreK-4 certification with PreK-12 Special Education,Bachelors,In Person,No,Dual,https://valleyforge.edu/academics/undergraduate-degrees/education/
Pennsylvania,Waynesburg University,Early Childhood Education (PreK-4) with Special Education Certification (PreK-12),Bachelors,In Person,No,Dual,https://www.waynesburg.edu/academics/departments/education/undergraduate-programs/early-childhood-education-prek-4-special
Pennsylvania,Waynesburg University,Special Education BA (PreK-Grade 12),Bachelors,In Person,No,ECSE,https://www.waynesburg.edu/academics/departments/education/undergraduate-programs/special-education-prek-12
Pennsylvania,West Chester University of Pennsylvania,B.S.E.d. in Special Education - PreK-12,Bachelors,In Person,No,ECSE,https://catalog.wcupa.edu/undergraduate/education-social-work/special-education/special-education-bsed-prek-12/
Pennsylvania,West Chester University of Pennsylvania,B.S.Ed. in Special Education - PreK-12 and Early Grades Preparation (PreK-4) - Double Major,Bachelors,In Person,No,Dual,https://catalog.wcupa.edu/undergraduate/education-social-work/special-education/special-education-bsed-prek-12-early-grades-prep/
Pennsylvania,Westminster College,"Early Childhood PK-4 and Special Education PK-12, B.A.",Bachelors,In Person,No,Dual,https://catalog.westminster.edu/preview_program.php?catoid=6&poid=691&returnto=239
Pennsylvania,Widener University,"Elementary Education (PK-4), and Special Education (PK-12), BA",Bachelors,In Person,No,Dual,https://www.widener.edu/academics/undergraduate-programs/elementary-education
Pennsylvania,Wilkes University,Elementary and Early Childhood Education Major with Dual Special Education Certification,Bachelors,In Person,No,Dual,https://www.wilkes.edu/academics/school-of-education/special-education-certification.aspx
Pennsylvania,Wilkes University,Middle Level Education Major with Dual Special Education (PK-12) Certification,Bachelors,In Person,No,ECSE,https://wilkes.edu/academics/colleges/school-of-education/special-education-certification.aspx
Pennsylvania,Wilson College,B.A. Special Education PreK-12,Bachelors,In Person,No,ECSE,https://online.wilson.edu/programs/bachelors-degrees/special-education/
Pennsylvania,York College of Pennsylvania,BA Early Elementary Education/Special Education,Bachelors,In Person,No,Dual,https://catalog.ycp.edu/preview_program.php?catoid=36&poid=3833&hl=BA+Early+Elementary+Education%2FSpecial+Education&returnto=search
Pennsylvania,Eastern University,BS Certification in Early Childhood w/ Special Education (PK-12),Certificate in conjunction with a Bachelors,In Person,No,Dual,https://www.eastern.edu/academics/undergraduate-programs/certification-early-childhood-w-special-education-pk-12
Pennsylvania,Washington & Jefferson College,Child Development and Education Dual Special Education Certification in PreK-12,Certificate in conjunction with a Bachelors,In Person,No,Dual,https://www.washjeff.edu/files/childedu/
Pennsylvania,Arcadia University,"Special Education, Certification PK-12 (Initial)",Post Bac. Certificate,In Person,No,ECSE,https://www.arcadia.edu/majors-and-programs/special-education-pk-12-certification/
Pennsylvania,Delaware Valley University,Add-on Sped Post-bacc,Post Bac. Certificate,In Person,No,ECSE,https://delval.edu/programs/graduate-programs/education-ms-post-graduate-certifications/post-graduate-certificates
Pennsylvania,Drexel University,Special? ?Education? ?Certification? ?program,Post Bac. Certificate,Online,No,ECSE,https://drexel.edu/soe/academics/certifications/special-education/
Pennsylvania,East Stroudsburg University of Pennsylvania,Pre-K-8 Special Education Post-Bacc Certification Preparation,Post Bac. Certificate,In Person,No,ECSE,https://esu.smartcatalogiq.com/2022-2023/Graduate-Catalog/Programs-and-Course-Descriptions/Special-Education
Pennsylvania,Eastern University,Certification in Special Education (PK-12),Post Bac. Certificate,Online,No,ECSE,https://www.eastern.edu/academics/undergraduate-programs/certification-special-education-pk-12
Pennsylvania,Gwynedd Mercy University,Online Special Education Certification Program (PreK-12),Post Bac. Certificate,Online,No,ECSE,https://www.gmercyu.edu/academics/programs/online-special-education-certification-prek-8
Pennsylvania,Keystone College,Accelerated Certification Program: Early Childhood Education/Special Education (PreK-12),Post Bac. Certificate,In Person,No,Dual,https://www.keystone.edu/academics/majors/education/teacher-certification-programs/
Pennsylvania,Keystone College,Accelerated Certification Program: Special Education,Post Bac. Certificate,In Person,No,ECSE,https://www.keystone.edu/academics/majors/education/teacher-certification-programs/
Pennsylvania,King's College,Post Baccalaureate: PK-4 ECE/PK-12 Special Education,Post Bac. Certificate,In Person,No,Dual,https://www.kings.edu/admissions/part-time/fast_track_certification
Pennsylvania,King's College,Post Baccalaureate: Special Education PK-12,Post Bac. Certificate,In Person,No,ECSE,https://www.kings.edu/admissions/part-time/fast_track_certification
Pennsylvania,Kutztown University of Pennsylvania,Post Baccalaureate: Special Education PK-12,Post Bac. Certificate,In Person,No,ECSE,https://www.kutztown.edu/academics/colleges-and-departments/education/departments/special-education/programs/post-baccalaureate-certification-in-special-education.html
Pennsylvania,Kutztown University of Pennsylvania,Post Baccalaureate: Visual Impairement,Post Bac. Certificate,In Person,No,ECSE,https://www.kutztown.edu/academics/colleges-and-departments/education/departments/special-education/programs/visual-impairment-certification-preparation-program.html
Pennsylvania,Lincoln University,Special Education PreK-8 certification only - no degree,Post Bac. Certificate,In Person,No,ECSE,https://www.lincoln.edu/_files/academics/2022Catalog-082122.pdf
Pennsylvania,Lycoming College,Post-Baccalaureate PK4 with Special Education PK-12 certification,Post Bac. Certificate,In Person,No,Dual,https://www.lycoming.edu/education/areas-of-certification.aspx
Pennsylvania,Messiah College,PDE Certification - Special Education Certification (PK-8 or 7-12),Post Bac. Certificate,Online,No,ECSE,https://www.messiah.edu/graduate/pde-special-education-certification
Pennsylvania,Millersville University of Pennsylvania,Post-bacc Special Education certification,Post Bac. Certificate,In Person,No,ECSE,https://www.millersville.edu/admissions/graduate/admissions/apply/post-baccalaureate-certification.php
Pennsylvania,Robert Morris University,Post-Bacc Teacher Certification in PK-12 Special Education,Post Bac. Certificate,In Person,No,ECSE,https://www.rmu.edu/academics/certificates/special-education-pk-12
Pennsylvania,Saint Francis University,Post Baccalaureate Special Education PK-12,Post Bac. Certificate,In Person,No,ECSE,https://catalog.francis.edu/preview_program.php?catoid=15&poid=6862&returnto=695
Pennsylvania,Saint Joseph's University,Special Education PK-12 Post Master's Certificate,Post Bac. Certificate,In Person,No,ECSE,https://academiccatalog.sju.edu/education-humandev/education/special-ed/pk12-pmct/
Pennsylvania,Saint Vincent College,Post-Baccalaureate Teacher Certification Special Ed PreK-12 Certification,Post Bac. Certificate,In Person,No,ECSE,https://www.stvincent.edu/academics/continuing-education.html#post-baccalaureate-teacher-certification
Pennsylvania,West Chester University of Pennsylvania,Post-Baccalaureate Certification in Special Education,Post Bac. Certificate,In Person,No,ECSE,https://catalog.wcupa.edu/graduate/education-social-work/special-education/post-baccalaureate-certification-special-education/
Pennsylvania,Westminster College,"Certification in Early Childhood PK-4 and Special Education PK-12, B.A.",Post Bac. Certificate,In Person,No,Dual,https://www.westminster.edu/academics/graduate/certifications.cfm
Pennsylvania,Widener University,Special Education (Pre-K-12) Certification,Post Bac. Certificate,In Person,No,ECSE,https://catalog.widener.edu/preview_program.php?catoid=34&poid=6231&hl=%22special+education%22&returnto=search
Pennsylvania,York College of Pennsylvania,Special Education Post-Baccalaureate (PreK-12) Certificate,Post Bac. Certificate,In Person,No,ECSE,https://catalog.ycp.edu/preview_program.php?catoid=36&poid=3988&hl=EARLY+ELEMENTARY%2FSPECIAL+EDUCATION&returnto=search
Pennsylvania,Cairn University-Langhorne,Dual-Level Instruction - Elementary/Early Childhood Education (PK-4) (BS in Education/MS in Special Education),Integrated Bachelors/Masters,Hybrid,No,Dual,https://catalog.cairn.edu/preview_program.php?catoid=41&poid=2620&returnto=1671
Pennsylvania,Cedar Crest College,BS ECE P-4 + MEd 4+1 SpEd P-12,Integrated Bachelors/Masters,In Person,No,Dual,https://www.cedarcrest.edu/fourplusone/index.shtm
Pennsylvania,Elizabethtown College,4+1 Master’s program in Special Education,Integrated Bachelors/Masters,Hybrid,No,Dual,https://www.etown.edu/depts/education/master-of-education.aspx#special
Pennsylvania,King's College,Five Year: PK-4/ Special Education/Reading Specialist,Integrated Bachelors/Masters,In Person,No,Dual,https://www.kings.edu/sites/default/files/graduate-flatsheets/2022/5_year_Reading_Program.pdf
Pennsylvania,Lancaster Bible College,BSEd ECE/MEd Special Ed P-4 and P-8,Integrated Bachelors/Masters,In Person,No,Dual,https://www.lbc.edu/undergraduate/academics/majors/special-education/
Pennsylvania,Marywood University,5 year Bachelor of Science Degree in Early Childhood/Elementary Education and Special Education and a Master of Science Degree in Reading Education,Integrated Bachelors/Masters,In Person,No,Dual,https://marywood.smartcatalogiq.com/2022-2023/undergraduate-catalog/college-of-professional-studies/school-of-education/education-degrees/five-year-bachelor-s-to-master-s-programs-in-education/
Pennsylvania,Mercyhurst University,4+1 Early Childhood Special Education,Integrated Bachelors/Masters,In Person,No,Dual,https://www.mercyhurst.edu/academics/4plus1programs
Pennsylvania,The Pennsylvania State University,M.Ed. in Special Education (the 4+1 program),Integrated Bachelors/Masters,In Person,No,Dual,https://www.worldcampus.psu.edu/degrees-and-certificates/penn-state-online-special-education-masters-degree#summary
Pennsylvania,University of Pittsburgh-Pittsburgh Campus,CASE Teacher Preparation,Integrated Bachelors/Masters,In Person,No,Dual,https://www.education.pitt.edu/academics/applied-developmental-psychology/case-teacher-preparation
Pennsylvania,Waynesburg University,"Five Year, Dual Degree and Dual Certification Program (Baccalaureate and Master's Degrees) Master of Education in Special Education",Integrated Bachelors/Masters,In Person,No,ECSE,https://www.waynesburg.edu/catalog/curriculum/education/five-year-dual-degree-dual-certification-program
Pennsylvania,Alvernia University,Special Education Certification,Graduate Certificate,Online,No,ECSE,https://www.alvernia.edu/academics/graduate-programs/graduate-teaching-certifications/special-education-certification
Pennsylvania,Bloomsburg University of Pennsylvania,CAGS Advanced Teacher Certification - Special Education Certification PK-12,Graduate Certificate,Hybrid,No,ECSE,https://www.bloomu.edu/academics/programs/special-education-ms-med
Pennsylvania,Bloomsburg University of Pennsylvania,CAGS Initial Teacher Certification - Special Education (PK-12) and Early Childhood Education (PK-4) Dual Cert No Degree,Graduate Certificate,Hybrid,No,Dual,https://www.bloomu.edu/special-education-graduate-programs
Pennsylvania,Cairn University-Langhorne,Special Education (PK-12) Certification,Graduate Certificate,Online,No,ECSE,https://cairn.edu/programs/online-special-education-certification/
Pennsylvania,Carlow University,Graduate Certificate in Special Education (PreK-12),Graduate Certificate,Hybrid,No,ECSE,https://www.carlow.edu/academic-programs/graduate-certificate-in-special-education-prek-12/
Pennsylvania,Immaculata University,PK-12 Special Education Certification,Graduate Certificate,In Person,No,ECSE,https://www.immaculata.edu/academics/degrees-programs/pk-12-special-education-certification-graduate-studies/
Pennsylvania,Indiana University of Pennsylvania-Main Campus,Special Education Certificate Only,Graduate Certificate,Hybrid,No,ECSE,https://www.iup.edu/special-ed/grad/certification-only/index.html
Pennsylvania,La Salle University,Cert only - EARLY CHILDHOOD (PREK–4) AND SPECIAL EDUCATION (PREK–8) CERTIFICATION,Graduate Certificate,Hybrid,No,Dual,https://www.lasalle.edu/grad-education-programs/early-childhood-prek-4-and-special-education-prek-8-certification/
Pennsylvania,La Salle University,Certification only - Special Education Pre-k through 12,Graduate Certificate,Hybrid,No,ECSE,https://www.lasalle.edu/grad-education-programs/special-education-certification/
Pennsylvania,Moravian University,Special Education Advanced Certification,Graduate Certificate,In Person,No,ECSE,https://www.moravian.edu/education/graduate-degrees-and-certifications/m-ed
Pennsylvania,University of Pittsburgh-Pittsburgh Campus,Certification as Teacher of Students with Visual Impairments (TVI),Graduate Certificate,Hybrid,No,ECSE,https://www.education.pitt.edu/academics/visual-impairment-and-blindness/certification-teacher-students-visual-impairments-tvi
Pennsylvania,Waynesburg University,Special education certification with NO masters of education,Graduate Certificate,In Person,No,ECSE,https://www.waynesburg.edu/academics/graduate-and-professional-studies/master-education/special-education-certification
Pennsylvania,Wilkes University,NO masters degree PK-12 Special Education Certification ONLINE,Graduate Certificate,Online,No,ECSE,https://www.wilkes.edu/bulletin/current/graduate/degrees-programs/education/ms-in-education-with-special-education-certification-option/index.aspx
Pennsylvania,Wilson College,TOP Special Education (PreK-12) (No degree),Graduate Certificate,In Person,No,ECSE,https://wilson.smartcatalogiq.com/current/catalog/major-and-minor-requirements/teacher-certification-pathways/top-special-education/
Pennsylvania,Alvernia University,Master of Education with Special Education Certification,Masters,Online,No,ECSE,https://www.alvernia.edu/academics/graduate-programs/master-education-programs/master-education-special-education-certification
Pennsylvania,Bloomsburg University of Pennsylvania,MEd Advanced Teacher Certification - Special Education Certification PK-12,Masters,Hybrid,No,ECSE,https://www.bloomu.edu/academics/programs/special-education-ms-med
Pennsylvania,Bloomsburg University of Pennsylvania,MEd Initial Teacher Certification - Special Education (PK-12) and Early Childhood Education (PK-4) Dual Cert Masters,Masters,Hybrid,No,Dual,https://www.bloomu.edu/academics/programs/special-education-ms-med
Pennsylvania,Bryn Athyn College of the New Church,"Master of Science in Special Education, Literacy Concentration Program",Masters,In Person,No,ECSE,https://brynathyn.edu/academics/graduate-programs/master-of-special-education.html
Pennsylvania,Cabrini University,Master of Education with Special Education Certification,Masters,Hybrid,No,ECSE,https://www.cabrini.edu/graduate-degrees/programs/education/masters-and-teacher-certifications
Pennsylvania,Carlow University,MEd in Special Education (PreK-12),Masters,Hybrid,No,ECSE,https://www.carlow.edu/academic-programs/med/masters-education-special-education/
Pennsylvania,Cedar Crest College,M.Ed Special Education Certification PreK-12,Masters,In Person,No,ECSE,https://www.cedarcrest.edu/sage/med/masterofed.shtm
Pennsylvania,Chestnut Hill College,M.Ed. in Dual: PreK-4 Education & Special Education PreK-12,Masters,In Person,No,Dual,https://www.chc.edu/dual-pk-4-special-education-pk-12
Pennsylvania,Chestnut Hill College,M.Ed. in Special Education (PreK -12),Masters,In Person,No,ECSE,https://www.chc.edu/med-special-education
Pennsylvania,Clarion University of Pennsylvania,M.Ed. Education: Special Education Concentration,Masters,Online,No,ECSE,https://www.clarion.edu/academics/colleges-and-schools/college-of-education-health-and-human-services/school-of-education/special-education/index.html#row-d13e203
Pennsylvania,Delaware Valley University,Special Education (M.S.) Assistive Technology Specialization,Masters,In Person,No,ECSE,https://delval.edu/programs/graduate-programs/special-education-ms
Pennsylvania,Delaware Valley University,Special Education (M.S.)Transition Skills Specialization,Masters,In Person,No,ECSE,https://delval.edu/programs/graduate-programs/special-education-ms
Pennsylvania,DeSales University,Special Education PreK-12 Master of Education and Certification TIP,Masters,Hybrid,Yes,ECSE,https://www.desales.edu/academics/academic-programs/detail/special-education-prek-12-Master-of-Education-and-Certification
