Kentucky,Northern Kentucky University,M.A. in Education: Teacher as Leader Interdisciplinary Early Childhood Education (Birth-K) Concentration,Masters,In Person,No,Blended,https://nku.edu/academics/coe/programs/graduate/maed.html
Kentucky,University of Kentucky,Master of Education Interdisciplinary Early Childhood Education - Non Thesis,Masters,Hybrid,No,Blended,https://education.uky.edu/edsrc/iece/med/   
Kentucky,University of Kentucky,Master of Education Interdisciplinary Early Childhood Education - Thesis,Masters,Hybrid,No,Blended,https://education.uky.edu/edsrc/iece/med/ 
Kentucky,University of Louisville,M.A.T. in Interdisciplinary Early Childhood Education (IECE),Masters,In Person,No,Blended,https://louisville.edu/education/degrees/mat-iece
Kentucky,University of Louisville,MAT in Interdisciplinary Early Childhood Education: Alternative Certification Program,Masters,Hybrid,Yes,Blended,https://catalog.louisville.edu/graduate/programs-study/master-of-arts-in-teaching-in-interdisciplinary-early-childhood-education-altcert/#text
Kentucky,University of Louisville,MAT Interdisciplinary Early Childhood Education: Alternative Certification Online Program,Masters,Online,Yes,Blended,https://louisville.edu/online/programs/masters/online-mat-in-interdisciplinary-early-childhood-education?utm_source=cehd-website-referral
Kentucky,University of Louisville,MAT Interdisciplinary Early Childhood Education: Traditional Online,Masters,Online,No,Blended,https://louisville.edu/online/programs/masters/online-mat-in-interdisciplinary-early-childhood-education?utm_source=cehd-website-referral
Kentucky,University of the Cumberlands,"Interdisciplinary Early Childhood Education, MAT",Masters,Online,No,Blended,https://www.ucumberlands.edu/academics/graduate/programs/master-arts-teaching
Kentucky,Western Kentucky University,"M.A.E. Interdisciplinary Early Childhood Education, Birth to Primary - Interdisciplinary Early Childhood Education (KIE)",Masters,In Person,No,Blended,https://catalog.wku.edu/graduate/education-behavioral-sciences/teacher-education/interdisciplinary-early-childhood-birth-primary-teacher-leaders-mae/#text
Kentucky,Western Kentucky University,"M.A.E. Interdisciplinary Early Childhood Education, Birth to Primary - Teaching English to Speakers of Other Languages (TESOL) (KE36) concentration",Masters,In Person,No,Blended,https://catalog.wku.edu/graduate/education-behavioral-sciences/teacher-education/interdisciplinary-early-childhood-birth-primary-teacher-leaders-mae/#text
Kentucky,Western Kentucky University,"M.A.E. interdisciplinary Early Childhood Education, Birth to Primary- Advanced Behavior Management (ABM)
concentration",Masters,In Person,No,Blended,https://catalog.wku.edu/graduate/education-behavioral-sciences/teacher-education/interdisciplinary-early-childhood-birth-primary-teacher-leaders-mae/#text
Kentucky,Western Kentucky University,"M.A.T. Interdisciplinary Early Childhood Education, Birth to Primary,-  Initial Certification",Masters,In Person,No,Blended,https://catalog.wku.edu/graduate/education-behavioral-sciences/teacher-education/interdisciplinary-early-childhood-birth-primary-initial-certification-mat/
Kentucky,Northern Kentucky University,Ed.S. Education Specialist (Rank I) Teacher Leader : Interdisciplinary Early Childhood Education,Ed.S.,In Person,No,Blended,https://www.nku.edu/academics/coe/programs/endorsements/earlychildhood.html 
Kentucky,Northern Kentucky University,Ed.S.Education Specialist in Teaching & Leading Rank 1 :Interdisciplinary Early Childhood Education (Birth-K) Concentration,Ed.S.,In Person,No,Blended,https://www.nku.edu/academics/coe/programs/endorsements/earlychildhood.html 
Kentucky,Eastern Kentucky University,Interdisciplinary Early Childhood Education Certification (IECE) - Traditional Initial Undergrad Certification Only,State Certification or Credential Only,In Person,No,Blended,https://catalogs.eku.edu/graduate/education-applied-human-sciences/teaching-learning-educational-leadership/iece/#text
Kentucky,Northern Kentucky University,Option 6 Certification Interdisciplinary Early Childhood Education (IECE) Birth-P,State Certification or Credential Only,In Person,Yes,Blended,http://onlinecatalog.nku.edu/preview_program.php?catoid=10&poid=1461&returnto=874
Kentucky,Western Kentucky University,"Interdisciplinary Early Childhood Education, Rank I",State Certification or Credential Only,In Person,No,Blended,https://catalog.wku.edu/graduate/education-behavioral-sciences/teacher-education/non-degree-planned-sixth-year-interdisciplinary-early-childhood-rI/#text
Louisiana,Nicholls State University,Birth to Five Early Interventionist Education (BFED),Bachelors,Hybrid,No,ECSE,https://www.nicholls.edu/education/teacher-education/birth-to-five-early-interventionist-education/
Louisiana,Northwestern State University of Louisiana,Master of Education in Special Education - Early Intervention,Masters,In Person,No,ECSE,https://www.nsula.edu/education/program-offerings/med-special-education/
Louisiana,Southeastern Louisiana University,MAT Special Education Early Intervention: Birth-5,Masters,Hybrid,Yes,ECSE,https://www.southeastern.edu/resources/catalog/2022_2023/graduate/grad_programs/mat.html
Louisiana,Southeastern Louisiana University,Special Education (M.Ed.) - Early Intervention,Masters,Hybrid,Yes,ECSE,http://www.southeastern.edu/acad_research/program-list/speced_med.html
Louisiana,University of Louisiana at Monroe,Master of Education in Curriculum and Instruction Online with Early Interventionist Add-On,Masters,Online,Yes,ECSE,https://online.ulm.edu/degrees/education/med/curriculum-and-instruction/
Louisiana,University of New Orleans,MASTER OF ARTS IN TEACHING (M.A.T.) – Early Intervention Birth-5,Masters,Online,Yes,ECSE,http://catalog.uno.edu/preview_program.php?catoid=8&poid=1978&hl=%22early+intervention%22&returnto=search
Louisiana,Northwestern State University of Louisiana,Early Interventionist Add-on,State Certification or Credential Only,In Person,No,ECSE,https://education.nsula.edu/home/program-offerings/add-on-areas/  
Louisiana,Southeastern Louisiana University,Certification-Only Alternative Teacher Certification Program - Special Education Early Intervention: Birth-5,State Certification or Credential Only,In Person,Yes,ECSE,https://www.southeastern.edu/resources/catalog/2022_2023/graduate/grad_programs/alt_cert.html
Louisiana,Southeastern Louisiana University,Early Intervention Add on Certificate,State Certification or Credential Only,In Person,No,ECSE,https://www.southeastern.edu/acad_research/colleges/edu_hd/programs/add_on/early/index.html
Louisiana,University of Louisiana at Monroe,Early Intervention Add On,State Certification or Credential Only,In Person,No,ECSE,https://www.ulm.edu/education/eteach/addon.html
Maine,University of Maine at Farmington,"Bachelor of Science: Early Childhood Special Education, Endorsement 282: Teacher of Children with Disabilities (Birth to School-Age Five)",Bachelors,In Person,No,ECSE,https://www.umf.maine.edu/academics/programs/early-childhood-special-education/
Maine,University of Maine at Farmington,"Bachelor of Science: Early Childhood Special Education, Endorsement 282: Teacher of Children with Disabilities (Birth to School-age five) and b) Endorsement 081: Birth to Age Five.",Bachelors,In Person,No,ECSE,https://www.umf.maine.edu/academics/programs/early-childhood-special-education/
Maine,University of Maine at Machias,Bachelor of Science in Education: Inclusive Early Childhood Concentration,Bachelors,Hybrid,No,Dual,https://machias.edu/online/explore-programs/ed/
Maine,University of Maine,M.Ed. in Special Education: Early Intervention - Early Childhood Concentration,Masters,Online,No,ECSE,https://online.umaine.edu/grad/master-of-education-in-special-education-concentration-in-early-intervention/
Maine,University of Maine at Farmington,Special Education Alternate Route to Certification (SPARC) – Graduate Studies,State Certification or Credential Only,Online,Yes,ECSE,https://www.umf.maine.edu/grad-studies/special-ed-alternate-route-to-certification-sparc/
Maryland,Bowie State University,"Early Childhood/Special Education, BS",Bachelors,In Person,No,Dual,https://catalog.bowiestate.edu/preview_program.php?catoid=17&poid=1607&returnto=1271
Maryland,Notre Dame of Maryland University,Bachelor of Arts Degrees** Early Childhood and Special Education,Bachelors,In Person,No,Dual,https://ndm.edu/undergraduate/academics/programs/education
Maryland,Towson University,Early Childhood & Special Education Major,Bachelors,In Person,No,Dual,https://www.towson.edu/coe/departments/specialed/undergrad/earlychildhood.html
Maryland,University of Maryland-College Park,B.S. Early Childhood and Early Childhood Special Education,Bachelors,In Person,No,ECSE,https://education.umd.edu/academics/programs/undergraduate/early-childhood-and-early-childhood-special-education-bachelor
Maryland,Bowie State University,MAT Early Childhood Education/Special Education,Masters,In Person,Yes,ECSE,https://catalog.bowiestate.edu/preview_program.php?catoid=18&poid=1729&hl=Teaching%2C+MA&returnto=search
Maryland,Towson University,M.Ed. in Special Education - Special Education Concentration,Masters,In Person,No,ECSE,https://www.towson.edu/coe/departments/specialed/grad/special-education/
Maryland,Towson University,MAT in Special Education Infant/Primary,Masters,Online,No,ECSE,https://www.towson.edu/coe/departments/teaching/
Massachusetts,Bay Path University,BA Severe Special Needs Licensure,Bachelors,In Person,No,ECSE,https://www.baypath.edu/academics/undergraduate-programs/severe-special-needs/
Massachusetts,Bridgewater State University,"Special Education, Teacher of Students with Moderate Disabilities (PreK-8) Concentration, BSE",Bachelors,In Person,No,ECSE,https://www.bridgew.edu/department/special-education/academic-programs
Massachusetts,Bridgewater State University,"Special Education, Teacher of Students with Severe Disabilities (All Levels) Concentration, BSE",Bachelors,In Person,No,ECSE,https://www.bridgew.edu/department/special-education/academic-programs
Massachusetts,College of Our Lady of the Elms,Moderate Special Needs (B.A.),Bachelors,In Person,No,ECSE,https://www.elms.edu/academics/education/moderate-special-needs/
Massachusetts,Curry College,BA Special Education - Applied Behavior Analysis Track,Bachelors,In Person,No,ECSE,https://www.curry.edu/academics/undergraduate-degrees-and-programs/education-degrees-and-programs/applied-behavior-analysis
Massachusetts,Curry College,BA Special Education - Moderate Disabilities,Bachelors,Hybrid,No,ECSE,https://www.curry.edu/academics/undergraduate-degrees-and-programs/education-degrees-and-programs/special-education-degree-major-and-minor
Massachusetts,Eastern Nazarene College,BA Education: Teacher of Students with Moderate Disabilities Pre K-8,Bachelors,In Person,No,ECSE,https://enc.edu/program/education/
Massachusetts,Fitchburg State University,BS Special Education Moderate Disabilities (PreK-8),Bachelors,In Person,No,ECSE,https://www.fitchburgstate.edu/academics/undergraduate/undergraduate-day-programs/special-education/special-education-moderate-disabilities-prek-8-elementary-education-initial-teacher-licensure/
Massachusetts,Lesley University,B.A. Special Education,Bachelors,In Person,No,ECSE,https://lesley.edu/academics/undergraduate/special-education
Massachusetts,Merrimack College,Moderate Disabilities Education BA (Pre-K to 8),Bachelors,In Person,No,ECSE,https://www.merrimack.edu/academics/education-and-social-policy/education-and-community-studies/majors/education/moderate-disabilities.php
Massachusetts,Springfield College,BA or BS in Special Education,Bachelors,In Person,No,ECSE,https://springfield.edu/programs/special-education
Massachusetts,Stonehill College,Special Education Licensure Program: Teacher of Students with Moderate Disabilities (PK-8),Bachelors,In Person,No,ECSE,https://www.stonehill.edu/programs/special-education/
Massachusetts,University of Massachusetts-Amherst,Education Major: Special Education Concentration,Bachelors,In Person,No,ECSE,https://www.umass.edu/education/academics/special-education-ba
Massachusetts,University of Massachusetts-Lowell,B.A. Ed. Education: Elementary and Moderate Disabilities,Bachelors,In Person,No,ECSE,https://www.uml.edu/catalog/undergraduate/fahss/departments/education/programs/major.aspx
Massachusetts,Westfield State University,Special Education Degree (B.S.E.) Moderate Disabilities with Licensure (PreK-8),Bachelors,In Person,No,ECSE,https://www.westfield.ma.edu/academics/degrees/special-education-degree-bse-moderate-disabilities-licensure-prek-8
Massachusetts,Gordon College,BS Early Childhood Education w/ Sped PreK-8 licensure,Certificate in conjunction with a Bachelors,In Person,No,Dual,https://www.gordon.edu/earlychildhood/courses
Massachusetts,Gordon College,BS Elementary Education w/ Sped PreK-8 licensure,Certificate in conjunction with a Bachelors,In Person,No,Dual,https://www.gordon.edu/academics/education/elementary
Massachusetts,University of Massachusetts-Dartmouth,"Special Education - Moderate Disabilities Online
Post-Baccalaureate Certificate",Post Bac. Certificate,Online,No,ECSE,https://www.umassd.edu/programs/special-ed-moderate-pbc-online/
Massachusetts,Westfield State University,"Moderate Disabilities PreK-8, Initial, Post-baccalaureate Licensure",Post Bac. Certificate,In Person,No,ECSE,https://www.westfield.ma.edu/academics/degrees/moderate-disabilities-prek-8-initial-post-baccalaureate-licensure
Massachusetts,Worcester State University,Post-Baccalaureate Certificate Program for Initial Teacher License in Moderate Disabilities,Post Bac. Certificate,In Person,No,ECSE,https://www.worcester.edu/programs/post-baccalaureate-certificate-program-for-initial-teacher-licensure-moderate-disabilities/
Massachusetts,Curry College,5th Year Masters of Education MEd (Accelerated dual degree program),Integrated Bachelors/Masters,Hybrid,No,Dual,https://www.curry.edu/academics/undergraduate-degrees-and-programs/education-degrees-and-programs/5th-year-med-dual-education-degree
Massachusetts,Fitchburg State University,BS Special Education Moderate Disabilities (PreK-8) 4+1,Integrated Bachelors/Masters,In Person,No,ECSE,https://www.fitchburgstate.edu/academics/undergraduate/undergraduate-day-programs/special-education/special-education-moderate-disabilities-prek-8-elementary-education-initial-teacher-licensure/
Massachusetts,Fitchburg State University,Special Education Severe Disabilities (All levels) Initial Teacher Licensure,Integrated Bachelors/Masters,In Person,No,ECSE,https://www.fitchburgstate.edu/academics/undergraduate/undergraduate-day-programs/special-education/special-education-severe-disabilities-all-levels-initial-teacher-licensure/
Massachusetts,Framingham State University,"4=1 M.Ed. Concentration Special Education, Teacher of Students with Moderate Disabilities",Integrated Bachelors/Masters,In Person,No,ECSE,https://www.framingham.edu/academics/graduate-studies/graduate-degree-programs/master-of-educ-special-education/med-concentration-special-education
Massachusetts,Massachusetts College of Liberal Arts,BA/MA Education (4+1) Program: Prek-2 Bachelors with add on of Moderate Disabilities Pre-K-8 with Masters degree,Integrated Bachelors/Masters,In Person,No,Dual,hhttps://catalog.mcla.edu/undergraduate/academic-programs-study/education/education---early-childhood-education-bs/   
Massachusetts,Westfield State University,"Education Accelerated Dual Degree Program BS i& Licensure in Elementary Education 1-5, MeD Moderate Disabilities PreK-8",Integrated Bachelors/Masters,In Person,No,Dual,https://www.westfield.ma.edu/academics/continuing-education-massachusetts/education-accelerated-dual-degree-program
Massachusetts,Anna Maria College,CAGS – Concentration in Moderate Disabilities,Graduate Certificate,In Person,No,ECSE,https://annamaria.edu/academics/graduate-studies/graduate-degrees/education-m-ed/#course https://annamaria.edu/wp-content/uploads/2020/12/Moderate-Diabilities-CAGS-Curr.-Map.pdf
Massachusetts,Assumption University,"Certificate of Advanced Graduate Study (C.A.G.S.)
in Special Education: Positive Behavior Supports - Professional Licensure",Graduate Certificate,In Person,No,ECSE,https://www.assumption.edu/sites/default/files/SpecialEducation2019V4.pdf https://www.assumption.edu/graduate/special-education
Massachusetts,Bay Path University,Moderate Disabilities (PreK-8) Professional Licensure Certificate,Graduate Certificate,Online,No,ECSE,https://www.baypath.edu/academics/graduate-programs/graduate-certificates/moderate-disabilities-prek-8-professional-licensure-certificate/
Massachusetts,Bay Path University,Severe Disabilities (PreK-12) Professional Licensure Certificate,Graduate Certificate,Online,No,ECSE,https://www.baypath.edu/academics/graduate-programs/graduate-certificates/severe-disabilities-prek-12-professional-licensure-certificate/
Massachusetts,Boston University,Graduate Certificate in Teaching Students with Moderate Disabilities (Pre-K–8),Graduate Certificate,Hybrid,No,ECSE,https://www.bu.edu/academics/wheelock/programs/special-education/graduate-certificate-in-teaching-students-with-moderate-disabilities-pre-k-8/
Massachusetts,Boston University,Graduate Certificate in Teaching Students with Severe Disabilities,Graduate Certificate,Hybrid,No,ECSE,https://www.bu.edu/academics/wheelock/programs/special-education/graduate-certificate-in-teaching-students-with-severe-disabilities/
Massachusetts,Endicott College,"Certificate in Special Education, Moderate Disabilities",Graduate Certificate,Hybrid,No,ECSE,https://www.endicott.edu/academics/schools/school-of-education/graduate-programs/certificate-programs/certificate-programs-in-education
Massachusetts,Endicott College,"Certificate in Special Education,Severe Disabilities",Graduate Certificate,Hybrid,No,ECSE,https://www.endicott.edu/academics/schools/school-of-education/graduate-programs/certificate-programs/certificate-programs-in-education
Massachusetts,Lasell University,"TEACHING BILINGUAL LEARNERS
WITH DISABILITIES CERTIFICATE",Graduate Certificate,Online,No,ECSE,https://www.lasell.edu/graduate-studies/academics/teaching-bilingual-learners-with-disabilities-certificate.html
Massachusetts,Regis College,Certificate in Teaching Special Education,Graduate Certificate,In Person,No,ECSE,https://www.regiscollege.edu/academics/majors-and-programs/med-certificate-programs/certificate-teaching-special-education
Massachusetts,Simmons University,Certificate: Severe Special Needs,Graduate Certificate,In Person,No,ECSE,https://simmons.smartcatalogiq.com/en/2021-2022/graduate-course-catalog/programs-of-study/program-in-education/certificate-severe-special-needs/
Massachusetts,Simmons University,Moderate Special Needs Certificate,Graduate Certificate,In Person,No,ECSE,https://simmons.smartcatalogiq.com/2021-2022/graduate-course-catalog/programs-of-study/program-in-education/certificate-moderate-special-needs/
Massachusetts,Springfield College,CAGS Special Education,Graduate Certificate,In Person,No,ECSE,https://springfield.edu/programs/special-education-cags
Massachusetts,University of Massachusetts-Boston,Special Education Post Masters Certificate prek-8,Graduate Certificate,In Person,No,ECSE,https://www.umb.edu/academics/program-finder/special-education-certificate/
Massachusetts,American International College,Master’s Degree (M.Ed.) Early Childhood,Masters,In Person,No,ECSE,https://www.aic.edu/school-of-education/program/early-childhood-education/
Massachusetts,American International College,MEd Moderate Disabilities - Licensure,Masters,In Person,No,ECSE,https://www.aic.edu/school-of-education/program/moderate-disabilities/
Massachusetts,Anna Maria College,Master of Education (M.Ed.)  Moderate Disabilities (Pre-K to 8,Masters,In Person,No,ECSE,https://annamaria.edu/academics/graduate-studies/graduate-degrees/education-m-ed/#course  
Massachusetts,Assumption University,MA Special Education Initial Licensure  for Teacher of Students with Moderate Disabilities (PreK-8 ),Masters,In Person,No,ECSE,https://www.assumption.edu/graduate/special-education https://www.assumption.edu/sites/default/files/SpecialEducation2019V4.pdf
Massachusetts,Assumption University,MA Special Education Professional Licensure,Masters,In Person,No,ECSE,https://www.assumption.edu/graduate/special-education https://www.assumption.edu/sites/default/files/SpecialEducation2019V4.pdf
Massachusetts,Bay Path University,MSEd in Special Education: Moderate Disabilities Initial Licensure,Masters,Online,No,ECSE,https://www.baypath.edu/academics/graduate-programs/special-education-msed-eds/moderate-disabilities-prek-8-initial-licensure/
Massachusetts,Bay Path University,MSEd in Special Education: Moderate Disabilities Levels PreK-8/Autism Endorsement,Masters,Online,No,ECSE,https://catalog.baypath.edu/graduate/academic-programs/master-science-education/special-education-moderate-disabilities-levels-prek8-autism-endorsement-concentration-ms/
Massachusetts,Bay Path University,"MSEd in Special Education: Moderate Disabilities Levels PreK-8/Autism Spectrum Disorders (Initial) Licensure Concentration, M.S.",Masters,Online,No,ECSE,https://catalog.baypath.edu/graduate/academic-programs/master-science-education/special-education-moderate-disabilities-levels-prek-8-autism-spectrum-disorders-concentration-ms/
Massachusetts,Bay Path University,MSEd in Special Education: Moderate Disabilities Levels PreK-8/Language and Literacy (Initial) Licensure Concentration,Masters,Online,No,ECSE,https://www.baypath.edu/academics/graduate-programs/special-education-msed-eds/moderate-disabilities-prek-8-initial-licensure/
Massachusetts,Bay Path University,MSEd in Special Education: Severe Disabilities Initial Licensure,Masters,Online,No,ECSE,https://www.baypath.edu/academics/graduate-programs/special-education-msed-eds/severe-disabilities-prek-12-initial-licensure/
Massachusetts,Bay Path University,MSEd in Special Education: Severe Disabilities PreK-12 Language & Literacy (Initial) Licensure Concentration,Masters,Online,No,ECSE,https://catalog.baypath.edu/graduate/academic-programs/master-science-education/special-education-severe-disabilities-all-levels--anguage-literacy-concentration-ms/
Massachusetts,Bay Path University,MSEd in Special Education: Severe Disabilities PreK-12/Autism Endorsement (Initial) Licensure Concentration,Masters,Online,No,ECSE,https://catalog.baypath.edu/graduate/academic-programs/master-science-education/special-education-severe-disabilities-all-levels-autism-endorsement-concentration-ms/
Massachusetts,Bay Path University,MSEd in Special Education: Severe Disabilities PreK-12/Autism Spectrum Disorders,Masters,Online,No,ECSE,https://catalog.baypath.edu/graduate/academic-programs/master-science-education/special-education-severe-disabilities-all-levels-autism-spectrum-disorders-concentration-ms/
Massachusetts,Boston College,M.Ed Dual License / Moderate Support Needs PreK - 8 / Early Childhood,Masters,In Person,No,Dual,https://www.bc.edu/bc-web/schools/lynch-school/academics/departments/tcs/special-education-licensure-offerings.html#tab-m_ed_early_childhood_moderate_support_needs
Massachusetts,Boston College,M.Ed. Dual License /Moderate and Extensive Support Needs / PreK-8 NO Prior license,Masters,In Person,No,ECSE,https://www.bc.edu/content/dam/bc1/schools/lsoe/academics/pos/tcs/2022-2023/Dual%20Moderate%20and%20Extensive%20Support%20Needs%20PreK-8%20or%205-12.pdf
Massachusetts,Boston College,M.Ed. Dual License /Moderate and Extensive Support Needs / PreK-8 Prior license,Masters,In Person,No,ECSE,https://www.bc.edu/content/dam/bc1/schools/lsoe/academics/pos/tcs/2022-2023/Dual%20Moderate%20and%20Extensive%20Support%20Needs%20PreK-8%20or%205-12.pdf
Massachusetts,Boston College,M.Ed./CAES in Special Education for Extensive Support Needs: no prior license,Masters,In Person,No,ECSE,https://www.bc.edu/content/bc-web/academics/sites/university-catalog/graduate/lynch.html#tab-department_of_teaching_curriculum_and_society
Massachusetts,Boston College,M.Ed./CAES in Special Education for Extensive Support Needs: prior license,Masters,In Person,No,ECSE,https://www.bc.edu/content/bc-web/academics/sites/university-catalog/graduate/lynch.html#tab-department_of_teaching_curriculum_and_society
Massachusetts,Boston College,M.Ed./CAES in Special Education for Moderate Support Needs - no prior l gen license,Masters,In Person,No,ECSE,https://www.bc.edu/content/bc-web/academics/sites/university-catalog/graduate/lynch.html#tab-department_of_teaching_curriculum_and_society
Massachusetts,Boston College,M.Ed./CAES in Special Education for Moderate Support Needs - prior gen en license,Masters,In Person,No,ECSE,https://www.bc.edu/content/bc-web/academics/sites/university-catalog/graduate/lynch.html#tab-department_of_teaching_curriculum_and_society
Massachusetts,Boston University,EdM in Curriculum & Teaching with Graduate Certificate in Specialization Areas - Special Education Prek-8 Moderate Disabilities,Masters,Hybrid,No,ECSE,https://www.bu.edu/academics/wheelock/programs/curriculum-teaching/edm/
Massachusetts,Boston University,EdM in Curriculum & Teaching with Graduate Certificate in Specialization Areas - Special Education Severe Disabilities,Masters,Hybrid,No,ECSE,https://www.bu.edu/academics/wheelock/programs/curriculum-teaching/edm/
Massachusetts,Boston University,EdM in Deaf Education - Initial License,Masters,Hybrid,No,ECSE,https://www.bu.edu/wheelock/academics/graduate/edm/master-education-education-deaf/
Massachusetts,Boston University,EdM in Special Education Teacher of Students with Moderate Disabilities (Pre-K–Grade 8),Masters,Hybrid,No,ECSE,https://www.bu.edu/academics/wheelock/programs/special-education/edm/
Massachusetts,Boston University,EdM in Special Education Teacher of Students with Severe Disabilities (Ages 3–21),Masters,Hybrid,No,ECSE,https://www.bu.edu/academics/wheelock/programs/special-education/edm/
