New Jersey,William Paterson University of New Jersey,"Teacher of Students with Disabilities - Alternate Route, CERT",Post Bac. Certificate,Online,Yes,ECSE,https://academiccatalog.wpunj.edu/preview_program.php?catoid=40&poid=11152&returnto=1953
New Jersey,William Paterson University of New Jersey,"Teacher of Students with Disabilities, CERT",Post Bac. Certificate,Online,No,ECSE,https://academiccatalog.wpunj.edu/preview_program.php?catoid=40&poid=11151&returnto=1953
New Jersey,Drew University,BA or BS/MAT (4+1) Special Ed Cert (TOSD),Integrated Bachelors/Masters,In Person,No,Dual,https://drew-undergraduate-catalog.coursedog.com/programs/iwL7jX2bYXkFlyNHrvSK
New Jersey,Fairleigh Dickinson University-Florham Campus,"BA/BS, MAT Dual Certification (P-3, Elementary, Secondary with Special Education)",Integrated Bachelors/Masters,In Person,No,Dual,https://www.fdu.edu/program/quest-ba-bs-mat-early-childhood-p-3-education/
New Jersey,Montclair State University,"Family Science & Human Dev Major, Families, Children and School Settings Concentration (B.A.)(Combined B.A./M.A.T with Teacher Certification in Grades P-3 and Teacher of Students with Disabilities.)",Integrated Bachelors/Masters,In Person,No,Dual,https://www.montclair.edu/combined-programs/programs-of-study/teaching-combined-bachelors-mat/
New Jersey,Ramapo College of New Jersey,4+1 Elementary Education BS and Special Education MA,Integrated Bachelors/Masters,In Person,No,Dual,https://www.ramapo.edu/catalog-2020-2021/6499-2/
New Jersey,Rutgers University-Camden,Accelerated BA/MAT Early Childhood / Elementary Concentration & Teacher of Students with Disabilities Certificate,Integrated Bachelors/Masters,In Person,No,Dual,https://teaching.camden.rutgers.edu/accelerated-ba-mat-program/
New Jersey,Rutgers University-New Brunswick,Five-Year Program in Special Education and Elementary Education (Certifications: Teacher of Students with Disabilities and Teacher of Elementary Education),Integrated Bachelors/Masters,In Person,No,Dual,https://gse.rutgers.edu/degree/5-year-program-with-certification-in-special-education-k-12-and-elementary-education-k-6/
New Jersey,Seton Hall University,"B.S.E., Elementary and Special Ed/M.S., Speech Language Pathology",Integrated Bachelors/Masters,In Person,No,Dual,https://www.shu.edu/educational-studies/curriculum-bse-elementary-special-ed-ms-speech-language-pathology.cfm
New Jersey,Seton Hall University,"BSE/MA in Special Education with Applied Behavior
Analysis",Integrated Bachelors/Masters,In Person,No,Dual,https://www.shu.edu/academics/bse-ma-with-aba.cfm
New Jersey,The College of New Jersey,Early Childhood Special Education (ECSE_MAT 01)—Five-Year Program (for TCNJ students only—Full Five-Year Undergraduate/Graduate Program),Integrated Bachelors/Masters,In Person,No,Dual,https://specialeducation.tcnj.edu/programs/early-childhood-special-education/
New Jersey,Bloomfield College,Graduate Certificate Teacher of Students with Disabilities Endorsement,Graduate Certificate,In Person,No,ECSE,https://bloomfield.edu/academics/graduate-programs/graduate-certification-programs-teacher-education
New Jersey,Kean University,Teacher of Students with Disabilities Certification Track A,Graduate Certificate,In Person,Yes,ECSE,http://kean.smartcatalogiq.com/2020-2021/Graduate-Catalog/Colleges-Programs-by-College/College-of-Education/School-of-Special-Education-and-Literacy/Department-of-Special-Education/Teacher-of-Students-with-Disabilities-Certification
New Jersey,Kean University,Teacher of Students with Disabilities Certification Track B,Graduate Certificate,In Person,No,ECSE,http://kean.smartcatalogiq.com/2020-2021/Graduate-Catalog/Colleges-Programs-by-College/College-of-Education/School-of-Special-Education-and-Literacy/Department-of-Special-Education/Teacher-of-Students-with-Disabilities-Certification
New Jersey,New Jersey City University,Special Education—Teacher of Students with Disabilities Endorsement (TOSD) Eligibility Program Grad Cert,Graduate Certificate,In Person,No,ECSE,https://catalog.njcu.edu/graduate/education/special-education/teacher-of-students-with-disabilities-endorsement-eligibility/
New Jersey,Rider University,Teacher of Students with Disabilities Certificate,Graduate Certificate,Online,No,ECSE,http://catalog.rider.edu/graduate/colleges-schools/education/programs-certificates/teacher-ofstudents-disabilities-certificate/
New Jersey,Rowan University,Certificate of Graduate Study in Special Education (COGS),Graduate Certificate,Online,No,ECSE,https://education.rowan.edu/academics/certificates-and-endorsements/cogs/special-ed.html
New Jersey,Rowan University,Graduate Endorsement: Teacher of Students with Disabilities,Graduate Certificate,Hybrid,No,ECSE,https://education.rowan.edu/academics/certificates-and-endorsements/graduate-endorsements/teacher-students-disabilities/
New Jersey,Rutgers University-Camden,Stand-alone certificate in Teacher of Students with Disabilities,Graduate Certificate,In Person,No,ECSE,https://teaching.camden.rutgers.edu/stand-alone-certificate-in-special-education/
New Jersey,Rutgers University-New Brunswick,Endorsement Program for Teacher of Students with Disabilities Certification,Graduate Certificate,Online,No,ECSE,https://gse.rutgers.edu/expertise_p/
New Jersey,Saint Elizabeth University,Certification: Teacher of Students with Disabilities,Graduate Certificate,In Person,No,ECSE,https://steu.smartcatalogiq.com/en/2021-2022/academic-catalog/academic-programs/education/certification-teacher-of-students-with-disabilities/
New Jersey,Saint Peter's University,Teacher of Students with Disabilities Certification,Graduate Certificate,In Person,No,ECSE,https://catalogs.saintpeters.edu/graduate/graduateeducation/teacherofstudentswithdisabilitiescertification/
New Jersey,Seton Hall University,Teacher of Students with Disabilities Endorsement,Graduate Certificate,In Person,No,ECSE,https://www.shu.edu/academics/teacher-of-students-with-disabilities-endorsement.cfm
New Jersey,Bloomfield College,Master of Arts in Special Education,Masters,In Person,No,ECSE,https://bloomfield.edu/academics/graduate-programs/master-arts-special-education
New Jersey,Caldwell University,M.A. in Special Education with Endorsement Strand 1,Masters,In Person,No,ECSE,https://www.caldwell.edu/programs/special-education/
New Jersey,Caldwell University,M.A. in Special Education with Endorsement Strand 2,Masters,In Person,No,ECSE,https://www.caldwell.edu/programs/special-education/
New Jersey,Caldwell University,M.A. in Special Education with Endorsement Strand 3,Masters,In Person,No,ECSE,https://www.caldwell.edu/programs/special-education/
New Jersey,Caldwell University,M.A. in Special Education with Endorsement Strand 4,Masters,In Person,No,ECSE,https://www.caldwell.edu/programs/special-education/
New Jersey,Centenary University,M.A. Special Education for students seeking both TOSD and LDTC certifications-(42 credits),Masters,In Person,No,ECSE,https://centenaryuniversity.smartcatalogiq.com/en/2022-2023/graduate-catalog/graduate-programs-of-study/education/masters-of-arts-in-special-education-36-42-credits/
New Jersey,Centenary University,M.A. Special Education for students who enter the program without Special Education Certification (39 Credits),Masters,In Person,No,ECSE,https://centenaryuniversity.smartcatalogiq.com/en/2022-2023/graduate-catalog/graduate-programs-of-study/education/masters-of-arts-in-special-education-36-42-credits/
New Jersey,Drew University,Master of Education in Teaching with Students with Disabilities Endorsement,Masters,In Person,No,ECSE,https://drew.edu/caspersen/teacher-education/master-of-education/
New Jersey,Drew University,Master of Arts in Teaching Elementary + TOSD,Masters,In Person,No,Dual,https://drew.edu/caspersen/teacher-education/master-of-arts-in-teaching/
New Jersey,Fairleigh Dickinson University-Florham Campus,Education for Certified Teachers MA: Teacher of Students with Disabilities,Masters,In Person,No,ECSE,https://www.fdu.edu/program/ma-education-for-certified-teachers-teacher-of-students-with-disabilities/
New Jersey,Felician University,Alternate Route: Early Childhood and Special Education: P-3 & Teacher of Students with Disabilities + MA in Education,Masters,In Person,Yes,Dual,https://felician.edu/academics/school-of-education/graduate-programs/alternate-route-early-childhood-p-3-teacher-of-students-with-disabilities-ma/
New Jersey,Felician University,Graduate Initial Licensure: Early Childhood Education (P–3) with TOSD Endorsement Master of Arts in Education,Masters,In Person,No,Dual,https://felician.edu/academics/school-of-education/graduate-programs/initial-teacher-licensure-preparation-programs/
New Jersey,Felician University,MA Special ed + Teacher of Students with Disabilities Endorsement (TOSD),Masters,In Person,No,ECSE,https://felician.edu/academics/school-of-education/graduate-programs/special-education-and-autism-studies/
New Jersey,Georgian Court University,MAT in Early Childhood (P-3) Education & Teacher of Students with Disabilities Endorsement,Masters,In Person,No,Dual,https://georgian.edu/academics/graduate-programs/education/
New Jersey,Georgian Court University,Teacher of Students with Disabilities Endorsement & M.Ed. Option,Masters,In Person,No,ECSE,https://catalog.georgian.edu/graduate/school-education/educational-services-advanced-studies-certificate-masters-degree-programs/instructional-endorsement-programs/teacher-students-disabilities/#text
New Jersey,Kean University,"Special Education, M.A.: Autism and Developmental Disabilities Option",Masters,In Person,No,ECSE,http://kean.smartcatalogiq.com/2020-2021/Graduate-Catalog/Colleges-Programs-by-College/College-of-Education/School-of-Special-Education-and-Literacy/Department-of-Special-Education/Special-Education-M-A-Autism-and-Developmental-Disabilities-Option
New Jersey,Kean University,"Special Education, M.A.: Learning and Behavioral Disabilities Option",Masters,In Person,No,ECSE,http://kean.smartcatalogiq.com/2020-2021/Graduate-Catalog/Colleges-Programs-by-College/College-of-Education/School-of-Special-Education-and-Literacy/Department-of-Special-Education/Special-Education-M-A-Learning-and-Behavioral-Disabilities-Option
New Jersey,Monmouth University,MSEd Special Education - Teacher of Students with Disabilities Track,Masters,In Person,No,ECSE,https://www.monmouth.edu/graduate/special-education-msed/teacher-of-students-with-disabilities/
New Jersey,Monmouth University,Master of Arts in Teaching (M.A.T.) Elementary + TOSD,Masters,In Person,No,Dual,https://catalog.monmouth.edu/graduate-catalog/education/curriculum-instruction/mat-initial-certification-elementary-track-k-6-elementary-certification-endorsement-teacher-students-disabilities/
New Jersey,Montclair State University,"MEd in Inclusive Education, Early Childhood (Preschool through Grade 3) Teachers / Teacher of Students with Disabilities Concentration, JUST TOSD certification",Masters,In Person,No,Dual,https://www.montclair.edu/graduate/programs-of-study/inclusive-education-p3/
New Jersey,Montclair State University,"MAT, Early Childhood Education (Preschool through Grade 3) and Teacher of Students with Disabilities",Masters,In Person,No,Dual,https://www.montclair.edu/graduate/programs-of-study/teaching-mat-with-dual-certification-in-early-childhood-education-p-3-and-teacher-of-students-with-disabilities/
New Jersey,Montclair State University,Special Education (MEd),Masters,In Person,No,ECSE,https://www.montclair.edu/graduate/programs-of-study/special-education-med/
New Jersey,New Jersey City University,"Early Childhood and Special Education (P-3 and Teacher of Students with Disabilities), M.A.T.",Masters,Online,No,Dual,https://catalog.njcu.edu/graduate/education/early-childhood/special-p3-teacher-students-disabilities-certification-endorsement-eligibility-mat/
New Jersey,New Jersey City University,"Special Education—Special Education with NPTNJ Program, MAT",Masters,In Person,Yes,ECSE,https://www.njcu.edu/academics/professional-education-and-lifelong-learning/new-pathways-teaching-nj/new-pathways-credit-conversions
New Jersey,New Jersey City University,"Special Education—Teacher of Students with Disabilities Endorsement Eligibility Program, M.A.T.",Masters,In Person,No,ECSE,https://catalog.njcu.edu/graduate/education/special-education/special-education-teacher-students-disabilities-endorsement-eligibility-program-mat/#requirementstext
New Jersey,New Jersey City University,"Special Education—Teacher of Students with Disabilities Program (Autism Specialization), M.A.T.",Masters,In Person,No,ECSE,https://catalog.njcu.edu/graduate/education/special-education/special-education-autism-specialization-mat/#newitemtext
New Jersey,Ramapo College of New Jersey,MA in Special Education,Masters,In Person,No,ECSE,https://www.ramapo.edu/catalog-2020-2021/mase/
New Jersey,Rider University,MA in Special Ed. with Teacher of Students with Disabilities Coursework,Masters,Online,No,ECSE,https://www.rider.edu/academics/colleges-schools/college-education-human-services/graduate/ma-special-education
New Jersey,Rowan University,Master of Arts in Special Education (M.A.) Track 1 Graduate Endorsement,Masters,Hybrid,No,ECSE,https://sites.rowan.edu/catalogs/_docs/2022-2023_graduate_complete_catalog.pdf
New Jersey,Rutgers University-Camden,Teacher Education (M.A.T.) Special Education,Masters,In Person,No,ECSE,https://teaching.camden.rutgers.edu/certification-programs/special-education/
New Jersey,Rutgers University-New Brunswick,Ed.M. in Special Education with Teacher of Students with Disabilities Certification and GSE Gifted Education Certificate,Masters,In Person,No,ECSE,https://gse.rutgers.edu/degree/ed-m-in-special-education-with-teacher-of-students-with-disabilities-certification/
New Jersey,Rutgers University-New Brunswick,Ed.M. program in Special Education Sequence for Teacher of Students with Disabilities,Masters,In Person,No,ECSE,https://gse.rutgers.edu/degree/ed-m-in-special-education-with-teacher-of-students-with-disabilities-certification/
New Jersey,Saint Elizabeth University,MA in Education with Emphasis in Special Education,Masters,In Person,No,ECSE,https://steu.smartcatalogiq.com/en/2021-2022/academic-catalog/academic-programs/education/ma-in-education/
New Jersey,Saint Peter's University,"Master of Arts in Education: Special Education, Applied Behavior Analysis (certification for teacher of students with disabilities)",Masters,In Person,No,ECSE,https://catalogs.saintpeters.edu/graduate/graduateeducation/masterofartsineducationspecialeducationappliedbehavioranalyst/
New Jersey,Saint Peter's University,"MASTER OF ARTS IN EDUCATION: SPECIAL EDUCATION, LITERACY (certification for teacher of students with disabilities)",Masters,In Person,No,ECSE,https://www.saintpeters.edu/academics/graduate-programs/education/master-of-arts-in-education/specializations/
New Jersey,Seton Hall University,"Master of Arts (M.A.)
Special Education",Masters,In Person,No,ECSE,https://www.shu.edu/academics/ma-special-education.cfm
New Jersey,The College of New Jersey,MAT in Special Education and Elementary Education,Masters,In Person,No,Dual,https://specialeducation.tcnj.edu/programs/special-education/graduate/courses-spec_mat01/
New Jersey,The College of New Jersey,Master of Education in Special Education (TOSD) Option 2,Masters,In Person,No,ECSE,https://graduate.tcnj.edu/wp-content/uploads/sites/223/2022/08/Graduate-Bulletin-2022-2023.pdf
New Jersey,The College of New Jersey,"Master of Education in Special Education (TOSD) Option 3 certification as a Teacher of Students who are Blind or have Visual 
Impairments: (SPEC_MED06)",Masters,In Person,No,ECSE,https://graduate.tcnj.edu/wp-content/uploads/sites/223/2022/08/Graduate-Bulletin-2022-2023.pdf
New Jersey,The College of New Jersey,Special Education Specialization (SPEC_MAT02)— Five-Year Program (for TCNJ students only—Full Five-Year Undergraduate/Graduate Program,Masters,In Person,No,ECSE,https://graduate.tcnj.edu/wp-content/uploads/sites/223/2022/08/Graduate-Bulletin-2022-2023.pdf
New Jersey,William Paterson University of New Jersey,"Special Education: Teacher of Students with Disabilities, MED",Masters,In Person,No,ECSE,https://www.wpunj.edu/coe/departments/SE-PC-DS/degrees-offered/med-teacher-of-students-with-disabilities.html
New Jersey,William Paterson University of New Jersey,"Elementary Education with Teacher of Students with Disabilities, MAT",Masters,In Person,No,Dual,https://academiccatalog.wpunj.edu/preview_program.php?catoid=40&poid=11100&returnto=1953
New Jersey,Fairleigh Dickinson University-Florham Campus,Teacher of Students with Disabilities,State Certification or Credential Only,In Person,No,ECSE,https://www.fdu.edu/program/ma-education-for-certified-teachers-teacher-of-students-with-disabilities/
New Jersey,Felician University,Alternate Route: Early Childhood and Special Education: P-3 & Teacher of Students with Disabilities No Masters,State Certification or Credential Only,In Person,Yes,Dual,https://felician.edu/academics/school-of-education/graduate-programs/alternate-route-early-childhood-p-3-teacher-of-students-with-disabilities-ma/
New Jersey,Felician University,Graduate Initial Licensure: Early Childhood Education (P–3) with TOSD Endorsement (No Masters),State Certification or Credential Only,In Person,No,Dual,https://felician.edu/academics/school-of-education/graduate-programs/initial-teacher-licensure-preparation-programs/
New Jersey,Felician University,Teacher of Students with Disabilities Endorsement (TOSD),State Certification or Credential Only,In Person,No,ECSE,https://felician.edu/academics/school-of-education/graduate-programs/stand-alone-endorsement-certification-preparation-programs/teacher-of-students-with-disabilities/
New Jersey,Georgian Court University,Teacher of Students with Disabilities Endorsement (no degree),State Certification or Credential Only,In Person,No,ECSE,https://georgian.edu/academics/graduate-programs/education/
New Jersey,Rowan University,Teacher of Students with Disabilities Endorsement Program,State Certification or Credential Only,In Person,No,ECSE,https://education.rowan.edu/academics/post-baccalaureate/teacher-of-student-with-disabilities/
New Jersey,Rutgers University-New Brunswick,Non-degree Special Education Endorsement Program,State Certification or Credential Only,Online,No,ECSE,https://gse.rutgers.edu/degree/non-degree-special-education-endorsement-program/
New Jersey,Saint Elizabeth University,Advanced Certification for Teaching 1 and 2 Elementary Ed + TOSD,State Certification or Credential Only,In Person,Yes,Dual,https://steu.smartcatalogiq.com/2022-2023/academic-catalog/academic-programs/education/accelerated-certification-for-teaching-act1-act2/
New Mexico,Eastern New Mexico University-Main Campus,Bachelor of Science in Early Childhood Education with Early Childhood Education Birth-PreK licensure,Bachelors,In Person,No,Blended,https://www.enmu.edu/academics/degrees-programs/undergraduate-degree/bachelor/early-childhood-education-birth-prek-licensure
New Mexico,Eastern New Mexico University-Main Campus,Bachelor of Science in Early Childhood Education with Early Childhood Education PreK-Grade 3 licensure,Bachelors,In Person,No,Blended,https://www.enmu.edu/academics/degrees-programs/undergraduate-degree/bachelor/early-childhood-education-with-prek-grade-3-licensure
New Mexico,Eastern New Mexico University-Main Campus,BA/BS in Education with Elementary (K-8) and Special Education (PreK-12) licensure,Bachelors,In Person,No,Dual,https://www.enmu.edu/academics/degrees-programs/undergraduate-degree/bachelor/elementary-education-special-education-teaching-degree#program-details
New Mexico,Eastern New Mexico University-Main Campus,Bachelor's Elementary/Special Education (Blended) - Bilingual Education,Bachelors,In Person,No,Dual,https://www.enmu.edu/academics/degrees-programs/undergraduate-degree/bachelor/elementary-education-special-education-teaching-degree
New Mexico,Eastern New Mexico University-Main Campus,Bachelor's Elementary/Special Education (Blended) - English as a Second Language,Bachelors,In Person,No,Dual,https://www.enmu.edu/academics/degrees-programs/undergraduate-degree/bachelor/elementary-education-special-education-teaching-degree
New Mexico,Eastern New Mexico University-Main Campus,Bachelor's Elementary/Special Education (Blended) - Language Arts,Bachelors,In Person,No,Dual,https://www.enmu.edu/academics/degrees-programs/undergraduate-degree/bachelor/elementary-education-special-education-teaching-degree
New Mexico,Eastern New Mexico University-Main Campus,Bachelor's Elementary/Special Education (Blended) - Reading,Bachelors,In Person,No,Dual,https://www.enmu.edu/academics/degrees-programs/undergraduate-degree/bachelor/elementary-education-special-education-teaching-degree
New Mexico,Navajo Technical University,Early Childhood Multicultural Education,Bachelors,In Person,No,Blended,http://www.navajotech.edu/academics/bachelor-of-science/early-childhood-multicultural-education
New Mexico,New Mexico Highlands University,BA Early Childhood Multicultural Education - Concentration: Age 3 to Grade 3,Bachelors,In Person,No,Blended,https://www.nmhu.edu/school-of-education-teacher-education-programs/#Early%20Childhood
New Mexico,New Mexico Highlands University,BA Early Childhood Multicultural Education - Concentration: Birth to Age 4 (Licensure Option),Bachelors,In Person,No,Blended,https://www.nmhu.edu/landing-early-childhood-multicultural-education/
New Mexico,New Mexico Highlands University,BA Early Childhood Multicultural Education - Concentration: Birth to Age 4 (Non-Licensure Option/NLIC),Bachelors,In Person,No,Blended,https://www.nmhu.edu/school-of-education-teacher-education-programs/#Early%20Childhood
New Mexico,New Mexico Highlands University,BA Major in Special Education - Minor in Special Education Leading to Licensure,Bachelors,In Person,No,ECSE,http://its.nmhu.edu/IntranetUploads/007893-2022-2023Un-822202222953.pdf
New Mexico,New Mexico Highlands University,BA Major in Special Education - Minor in Special Education without Licensure,Bachelors,In Person,No,ECSE,http://its.nmhu.edu/IntranetUploads/007893-2022-2023Un-822202222953.pdf
New Mexico,New Mexico State University-Main Campus,Applied Studies (Zero-to-Four (Early Childhood)) - Bachelor of Applied Studies (non-licensure concentration),Bachelors,In Person,No,Blended,https://catalogs.nmsu.edu/nmsu/health-education-social-transformation/tpal/applied-studies-ztf-bas/#roadmaptext
New Mexico,New Mexico State University-Main Campus,Bachelors Degree in Early Childhood Education - Licensure Program,Bachelors,Hybrid,No,Blended,https://tpal.nmsu.edu/degree-programs/undergraduate-programs/ug-ece.html
New Mexico,New Mexico State University-Main Campus,Bachelors Degree in Early Childhood Education - Non-Licensure Program,Bachelors,Hybrid,No,Blended,https://tpal.nmsu.edu/degree-programs/undergraduate-programs/ug-ece.html
New Mexico,Northern New Mexico College,Bachelor of Arts EARLY CHILDHOOD EDUCATION–LICENSURE,Bachelors,In Person,No,Blended,https://nnmc.edu/home/academics/schools-and-departments/college-of-education/ece-ee/
New Mexico,University of New Mexico-Main Campus,"Early Childhood Multicultural Education Licensure Pre-K to Grade 3, B.S.",Bachelors,In Person,No,Blended,https://coehs.unm.edu/departments-programs/ifce/family-child-studies/index.html
New Mexico,University of New Mexico-Main Campus,Dual License Preparation: Special Education (Pre K–12) and Elementary Education (K–8),Bachelors,Hybrid,No,Dual,https://coehs.unm.edu/departments-programs/spcd/special-education-program/bsed.html
New Mexico,University of the Southwest,BS Early Childhood B-3,Bachelors,Online,No,Blended,https://www.usw.edu/undergraduate-programs/early-childhood-education
New Mexico,University of the Southwest,BS in Education - Special Education General science,Bachelors,Online,No,ECSE,https://www.usw.edu/undergraduate-programs/special-education-(science)
New Mexico,University of the Southwest,BS in Education - Special Education Language Arts,Bachelors,Online,No,ECSE,https://www.usw.edu/undergraduate-programs/special-education-(language-arts)
New Mexico,University of the Southwest,BS in Education - Special Education Mathematics,Bachelors,Online,No,ECSE,https://www.usw.edu/undergraduate-programs/special-education-(mathematics)
New Mexico,University of the Southwest,BS in Education - Special Education Social Science,Bachelors,Online,No,ECSE,https://www.usw.edu/undergraduate-programs/special-education-(social-studies)
New Mexico,Western New Mexico University,Bachelor of Science in Early Childhood Education Age 3 to Grade 3 Concentration + Licensure,Bachelors,Online,No,Blended,https://soe.wnmu.edu/undergraduate/ecp/bs/?utm_source=degrees-dropdown&utm_medium=call-to-action&utm_campaign=call-to-action-homepage#contact-information
New Mexico,Western New Mexico University,Bachelor of Science in Early Childhood Education B-Age 4 Concentration + licensure,Bachelors,Online,No,Blended,https://soe.wnmu.edu/undergraduate/ecp/bs/?utm_source=degrees-dropdown&utm_medium=call-to-action&utm_campaign=call-to-action-homepage#contact-information
New Mexico,Western New Mexico University,BS Special Education (Licensure) Language Arts + General Science,Bachelors,Online,No,ECSE,https://soe.wnmu.edu/undergraduate/bs/
New Mexico,Western New Mexico University,BS Special Education (Licensure) Language Arts + Math,Bachelors,Online,No,ECSE,https://soe.wnmu.edu/undergraduate/bs/
New Mexico,Western New Mexico University,BS Special Education (Licensure) Language Arts + Social Studies,Bachelors,Online,No,ECSE,https://soe.wnmu.edu/undergraduate/bs/
New Mexico,San Juan College,Special Education Alternative Licensure Certificate,Post Bac. Certificate,Hybrid,Yes,ECSE,https://www.sanjuancollege.edu/education-social-science-and-public-safety/teacher-education/
